{
  "content_hash": "986e0f36d66c45b981da4040043310aec461431bb3e9c742a14940617eb53995",
  "format": "rpg-world-forge.asset_processing_receipt",
  "format_version": 1,
  "inputs": [
    {
      "artifact": {
        "file": "generated/neutral.frag",
        "sha256": "e09925e3698ecaf81210ec28fb261a44dd517cb744907d060253af1edb93dfd3"
      },
      "id": "source"
    }
  ],
  "operation": "file_validate",
  "outputs": [
    {
      "artifact": {
        "file": "neutral.frag",
        "sha256": "e09925e3698ecaf81210ec28fb261a44dd517cb744907d060253af1edb93dfd3"
      },
      "details": {
        "byte_length": 16
      },
      "media_type": "text/x-glsl",
      "role": "fragment_shader"
    }
  ],
  "recipe": {
    "content_hash": "b25ab3db6a12fb11f6664732612b722d2c5346dfec0752dbaf94bfb58a78cfab",
    "sha256": "2eb7c5f29e68b12dec09ed2e3ee58fbbaa7d3f3fa6f1f93145994fcf15f5b639"
  },
  "toolchain": {
    "processor": "worldforge.asset_processing",
    "python_version": "3.12.3",
    "validator": "strict_builtin_v1"
  }
}
