{
  "content_hash": "c40302f122871b27c8f2e96622de872d5f149bcc6ac6177eb5c38150e35f9f73",
  "format": "rpg-world-forge.asset_processing_receipt",
  "format_version": 2,
  "inputs": [
    {
      "artifact": {
        "file": "generated/neutral_sfx.wav",
        "sha256": "ba0d2d36fa331ad75c2544a45b8d5017107f711d387ab901a3b0586ca5561683"
      },
      "id": "source"
    }
  ],
  "operation": "wav_pcm",
  "outputs": [
    {
      "artifact": {
        "file": "neutral_sfx.wav",
        "sha256": "154b6f3cfe339656b8d0e87e17e37906e1e3f6f47675f571c464972f9216e2ca"
      },
      "details": {
        "channels": 1,
        "frames": 799,
        "peak": 12000,
        "sample_rate": 8000,
        "sample_width": 2
      },
      "media_type": "audio/wav",
      "role": "audio"
    }
  ],
  "recipe_ref": {
    "content_hash": "7a7d8f1518e07f186ba2e6187e6bc825143a218c78594c72e2719eebe488dde7",
    "file": "recipes/neutral_sfx.json",
    "sha256": "4a30969b32cf39af80c9ca631df0f2671995512fb231adc01487978a912257c7"
  },
  "toolchain": {
    "processor": "worldforge.asset_processing",
    "python_version": "3.12.3",
    "wave_module": "stdlib"
  }
}
